<?xml version="1.0" encoding="UTF-8"?>

<bank xmlns:xsi="http://www.w3.org/2001/XMLSchema-instance"
      xsi:noNamespaceSchemaLocation="bank.xsd">

  <branch>
    <row><branch_name>Calangute_Br</branch_name><branch_city>Calangute</branch_city><assets>4300000</assets></row>
    <row><branch_name>Bicholim_Br</branch_name><branch_city>Bicholim</branch_city><assets>3900000</assets></row>
    <row><branch_name>Mapusa_Br</branch_name><branch_city>Mapusa</branch_city><assets>6500000</assets></row>
    <row><branch_name>Margao_Br</branch_name><branch_city>Margao</branch_city><assets>8900000</assets></row>
    <row><branch_name>Panaji_Main</branch_name><branch_city>Panaji</branch_city><assets>12000000</assets></row>
    <row><branch_name>Pernem_Br</branch_name><branch_city>Pernem</branch_city><assets>3600000</assets></row>
    <row><branch_name>Ponda_Br</branch_name><branch_city>Ponda</branch_city><assets>5100000</assets></row>
    <row><branch_name>Vasco_Br</branch_name><branch_city>Vasco</branch_city><assets>7400000</assets></row>
  </branch>

  <account>
    <row><account_number>A1001</account_number><balance>15000</balance><branch_name>Panaji_Main</branch_name></row>
    <row><account_number>A1002</account_number><balance>32000</balance><branch_name>Panaji_Main</branch_name></row>
    <row><account_number>A1003</account_number><balance>5400</balance><branch_name>Mapusa_Br</branch_name></row>
    <row><account_number>A1004</account_number><balance>88000</balance><branch_name>Margao_Br</branch_name></row>
    <row><account_number>A1005</account_number><balance>25000</balance><branch_name>Vasco_Br</branch_name></row>
    <row><account_number>A1006</account_number><balance>9100</balance><branch_name>Ponda_Br</branch_name></row>
    <row><account_number>A1007</account_number><balance>47000</balance><branch_name>Calangute_Br</branch_name></row>
    <row><account_number>A1008</account_number><balance>1200</balance><branch_name>Bicholim_Br</branch_name></row>
    <row><account_number>A1009</account_number><balance>6700</balance><branch_name>Pernem_Br</branch_name></row>
    <row><account_number>A1010</account_number><balance>99000</balance><branch_name>Panaji_Main</branch_name></row>
    <row><account_number>A1011</account_number><balance>45000</balance><branch_name>Margao_Br</branch_name></row>
    <row><account_number>A1012</account_number><balance>3000</balance><branch_name>Mapusa_Br</branch_name></row>
    <row><account_number>A1013</account_number><balance>81000</balance><branch_name>Vasco_Br</branch_name></row>
    <row><account_number>A1014</account_number><balance>7600</balance><branch_name>Ponda_Br</branch_name></row>
    <row><account_number>A1015</account_number><balance>26000</balance><branch_name>Calangute_Br</branch_name></row>
    <row><account_number>A1016</account_number><balance>55000</balance><branch_name>Bicholim_Br</branch_name></row>
    <row><account_number>A1017</account_number><balance>8800</balance><branch_name>Pernem_Br</branch_name></row>
    <row><account_number>A1018</account_number><balance>41000</balance><branch_name>Panaji_Main</branch_name></row>
  </account>

  <customer>
    <row><customer_name>Aarav</customer_name><customer_street>MG Road</customer_street><customer_city>Panaji</customer_city></row>
    <row><customer_name>Advait</customer_name><customer_street>Port Road</customer_street><customer_city>Vasco</customer_city></row>
    <row><customer_name>Ananya</customer_name><customer_street>Beach Road</customer_street><customer_city>Calangute</customer_city></row>
    <row><customer_name>Arjun</customer_name><customer_street>Temple Road</customer_street><customer_city>Ponda</customer_city></row>
    <row><customer_name>Diya</customer_name><customer_street>Station Road</customer_street><customer_city>Vasco</customer_city></row>
    <row><customer_name>Ishaan</customer_name><customer_street>Market Street</customer_street><customer_city>Mapusa</customer_city></row>
    <row><customer_name>Kabir</customer_name><customer_street>Hill Road</customer_street><customer_city>Pernem</customer_city></row>
    <row><customer_name>Karan</customer_name><customer_street>River Road</customer_street><customer_city>Ponda</customer_city></row>
    <row><customer_name>Meera</customer_name><customer_street>Lake View</customer_street><customer_city>Bicholim</customer_city></row>
    <row><customer_name>Nisha</customer_name><customer_street>Main Street</customer_street><customer_city>Margao</customer_city></row>
    <row><customer_name>Priya</customer_name><customer_street>Fort Road</customer_street><customer_city>Panaji</customer_city></row>
    <row><customer_name>Rahul</customer_name><customer_street>Garden Road</customer_street><customer_city>Mapusa</customer_city></row>
    <row><customer_name>Riley</customer_name><customer_street>Hostel Road</customer_street><customer_city>Goa</customer_city></row>
    <row><customer_name>Saanvi</customer_name><customer_street>Sunset Lane</customer_street><customer_city>Panaji</customer_city></row>
    <row><customer_name>Sneha</customer_name><customer_street>Palm Street</customer_street><customer_city>Calangute</customer_city></row>
    <row><customer_name>Vihaan</customer_name><customer_street>Church Road</customer_street><customer_city>Margao</customer_city></row>
  </customer>

  <loan>
    <row><loan_number>L2001</loan_number><amount>150000</amount><branch_name>Panaji_Main</branch_name></row>
    <row><loan_number>L2002</loan_number><amount>80000</amount><branch_name>Mapusa_Br</branch_name></row>
    <row><loan_number>L2003</loan_number><amount>250000</amount><branch_name>Margao_Br</branch_name></row>
    <row><loan_number>L2004</loan_number><amount>120000</amount><branch_name>Vasco_Br</branch_name></row>
    <row><loan_number>L2005</loan_number><amount>60000</amount><branch_name>Ponda_Br</branch_name></row>
    <row><loan_number>L2006</loan_number><amount>90000</amount><branch_name>Calangute_Br</branch_name></row>
    <row><loan_number>L2007</loan_number><amount>45000</amount><branch_name>Bicholim_Br</branch_name></row>
    <row><loan_number>L2008</loan_number><amount>110000</amount><branch_name>Pernem_Br</branch_name></row>
    <row><loan_number>L2009</loan_number><amount>300000</amount><branch_name>Panaji_Main</branch_name></row>
    <row><loan_number>L2010</loan_number><amount>95000</amount><branch_name>Margao_Br</branch_name></row>
    <row><loan_number>L2011</loan_number><amount>70000</amount><branch_name>Mapusa_Br</branch_name></row>
    <row><loan_number>L2012</loan_number><amount>50000</amount><branch_name>Vasco_Br</branch_name></row>
  </loan>

  <depositor>
    <row><customer_name>Riley</customer_name><account_number>A1001</account_number></row>
    <row><customer_name>Aarav</customer_name><account_number>A1002</account_number></row>
    <row><customer_name>Ananya</customer_name><account_number>A1007</account_number></row>
  </depositor>

  <borrower>
    <row><customer_name>Riley</customer_name><loan_number>L2001</loan_number></row>
    <row><customer_name>Nisha</customer_name><loan_number>L2003</loan_number></row>
  </borrower>

</bank>
